{
  "attachmentVersion": "1",
  "content": {
    "chars": 264,
    "extraction": "text-layer",
    "kind": "text",
    "pageCount": 3,
    "pages": [
      {
        "chars": 159,
        "extraction": "text-layer",
        "number": 1,
        "status": "ok",
        "text": "Federal Skilled Worker Program\nMinimum requirements\n\nTo be eligible you must meet the minimum requirements for work experience, language ability and education.",
        "unmapped": 0
      },
      {
        "chars": 105,
        "extraction": "text-layer",
        "number": 2,
        "status": "ok",
        "text": "Work experience\nYour work experience must be at least one year, continuous, paid, in the same occupation.",
        "unmapped": 0
      },
      {
        "chars": 0,
        "extraction": "text-layer",
        "number": 3,
        "status": "no-text",
        "text": "",
        "unmapped": 0
      }
    ],
    "truncated": false
  },
  "document": {
    "detectedMediaType": "application/pdf",
    "encryption": null,
    "id": "sha256:fb8533950579cf680ea38bc2d04ba14f415958571671060a654d13283f7e56f3",
    "mediaType": "application/pdf",
    "name": "fswp.pdf",
    "size": 184320,
    "version": null
  },
  "original": {
    "bytes": null,
    "encoding": null,
    "retention": "caller"
  },
  "processing": {
    "bounds": {
      "maxBytes": 16777216,
      "maxInflateBytes": 67108864,
      "maxOcrOutputBytes": 33554432,
      "maxPages": 500,
      "maxTextBytes": 8388608,
      "timeoutMs": 25000
    },
    "durationMs": 118,
    "errors": [],
    "status": "complete"
  },
  "provenance": {
    "adapter": {
      "digest": "sha256:9c1e9c1e9c1e9c1e9c1e9c1e9c1e9c1e9c1e9c1e9c1e9c1e9c1e9c1e9c1e9c1e",
      "name": "adapter-document",
      "version": "0"
    },
    "observedAt": "2026-09-16T14:05:11Z",
    "ocr": null,
    "processor": "adapter-document/pdf/1",
    "source": {
      "kind": "inline"
    }
  }
}
