{
  "attachmentVersion": "1",
  "content": {
    "chars": 0,
    "extraction": "verbatim",
    "kind": "text",
    "pageCount": 1,
    "pages": [
      {
        "chars": 0,
        "extraction": "verbatim",
        "number": 1,
        "status": "no-text",
        "text": "",
        "unmapped": 0
      }
    ],
    "truncated": false
  },
  "document": {
    "detectedMediaType": "text/plain",
    "encryption": null,
    "id": "sha256:01ba4719c80b6fe911b091a7c05124b64eeece964e09c058ef8f9805daca546b",
    "mediaType": "text/plain",
    "name": "blank.txt",
    "size": 1,
    "version": null
  },
  "original": {
    "bytes": null,
    "encoding": null,
    "retention": "caller"
  },
  "processing": {
    "bounds": {
      "maxBytes": 16777216,
      "maxInflateBytes": 67108864,
      "maxOcrOutputBytes": 33554432,
      "maxPages": 500,
      "maxTextBytes": 8388608,
      "timeoutMs": 25000
    },
    "durationMs": 1,
    "errors": [],
    "status": "complete"
  },
  "provenance": {
    "adapter": {
      "digest": "sha256:9c1e9c1e9c1e9c1e9c1e9c1e9c1e9c1e9c1e9c1e9c1e9c1e9c1e9c1e9c1e9c1e",
      "name": "adapter-document",
      "version": "0"
    },
    "observedAt": "2026-09-16T14:05:11Z",
    "ocr": null,
    "processor": "adapter-document/text/1",
    "source": {
      "kind": "inline"
    }
  }
}
