{
  "attachmentVersion": "1",
  "content": {
    "chars": 0,
    "extraction": "none",
    "kind": "text",
    "pageCount": 2,
    "pages": [
      {
        "chars": 0,
        "extraction": "none",
        "number": 1,
        "status": "needs-ocr",
        "text": "",
        "unmapped": 0
      },
      {
        "chars": 0,
        "extraction": "none",
        "number": 2,
        "status": "needs-ocr",
        "text": "",
        "unmapped": 0
      }
    ],
    "truncated": false
  },
  "document": {
    "detectedMediaType": "application/pdf",
    "encryption": null,
    "id": "sha256:900db3ec3bae665c4655646b584de4b76db637cb94a959a2ebb7a5fa5534aae6",
    "mediaType": "application/pdf",
    "name": "scan.pdf",
    "size": 614400,
    "version": null
  },
  "original": {
    "bytes": null,
    "encoding": null,
    "retention": "caller"
  },
  "processing": {
    "bounds": {
      "maxBytes": 16777216,
      "maxInflateBytes": 67108864,
      "maxOcrOutputBytes": 33554432,
      "maxPages": 500,
      "maxTextBytes": 8388608,
      "timeoutMs": 25000
    },
    "durationMs": 118,
    "errors": [
      {
        "code": "ocr-not-run",
        "message": "2 pages have images and no text layer, and no OCR program is configured for this source",
        "page": null
      }
    ],
    "status": "partial"
  },
  "provenance": {
    "adapter": {
      "digest": "sha256:9c1e9c1e9c1e9c1e9c1e9c1e9c1e9c1e9c1e9c1e9c1e9c1e9c1e9c1e9c1e9c1e",
      "name": "adapter-document",
      "version": "0"
    },
    "observedAt": "2026-09-16T14:05:11Z",
    "ocr": null,
    "processor": "adapter-document/pdf/1",
    "source": {
      "kind": "inline"
    }
  }
}
