{
  "attachmentVersion": "1",
  "content": {
    "chars": 55,
    "extraction": "mixed",
    "kind": "text",
    "pageCount": 3,
    "pages": [
      {
        "chars": 36,
        "extraction": "text-layer",
        "number": 1,
        "status": "ok",
        "text": "Re: your application\nDecision letter",
        "unmapped": 0
      },
      {
        "chars": 19,
        "extraction": "ocr",
        "number": 2,
        "status": "ok",
        "text": "SIGNED\nOfficer 4412",
        "unmapped": 0
      },
      {
        "chars": 0,
        "extraction": "none",
        "number": 3,
        "status": "needs-ocr",
        "text": "",
        "unmapped": 0
      }
    ],
    "truncated": false
  },
  "document": {
    "detectedMediaType": "application/pdf",
    "encryption": null,
    "id": "sha256:dfb8dfab820c6aad055e8ac518ade52f7d8b4c132005043d09d5355767191af1",
    "mediaType": "application/pdf",
    "name": "letter-3.pdf",
    "size": 512000,
    "version": null
  },
  "original": {
    "bytes": null,
    "encoding": null,
    "retention": "caller"
  },
  "processing": {
    "bounds": {
      "maxBytes": 16777216,
      "maxInflateBytes": 67108864,
      "maxOcrOutputBytes": 33554432,
      "maxPages": 500,
      "maxTextBytes": 8388608,
      "timeoutMs": 25000
    },
    "durationMs": 8800,
    "errors": [
      {
        "code": "ocr-incomplete",
        "message": "the OCR program was asked for 2 pages and answered 1; the rest need OCR",
        "page": null
      }
    ],
    "status": "partial"
  },
  "provenance": {
    "adapter": {
      "digest": "sha256:9c1e9c1e9c1e9c1e9c1e9c1e9c1e9c1e9c1e9c1e9c1e9c1e9c1e9c1e9c1e9c1e",
      "name": "adapter-document",
      "version": "0"
    },
    "observedAt": "2026-09-16T14:05:11Z",
    "ocr": {
      "digest": "sha256:ab12ab12ab12ab12ab12ab12ab12ab12ab12ab12ab12ab12ab12ab12ab12ab12",
      "pages": [
        2
      ],
      "program": "ocr-pages"
    },
    "processor": "adapter-document/pdf/1",
    "source": {
      "kind": "inline"
    }
  }
}
