{
  "attachmentVersion": "1",
  "content": {
    "chars": 36,
    "extraction": "text-layer",
    "kind": "text",
    "pageCount": 2,
    "pages": [
      {
        "chars": 36,
        "extraction": "text-layer",
        "number": 1,
        "status": "ok",
        "text": "Re: your application\nDecision letter",
        "unmapped": 0
      },
      {
        "chars": 0,
        "extraction": "none",
        "number": 2,
        "status": "needs-ocr",
        "text": "",
        "unmapped": 0
      }
    ],
    "truncated": false
  },
  "document": {
    "detectedMediaType": "application/pdf",
    "encryption": null,
    "id": "sha256:c6fd3de54ffd4fb73e6f2f917e4bc7cedc56cf207936bb3e6b5e026dd7b233e0",
    "mediaType": "application/pdf",
    "name": "mixed.pdf",
    "size": 1226,
    "version": null
  },
  "original": {
    "bytes": null,
    "encoding": null,
    "retention": "caller"
  },
  "processing": {
    "bounds": {
      "maxBytes": 16777216,
      "maxInflateBytes": 67108864,
      "maxOcrOutputBytes": 33554432,
      "maxPages": 500,
      "maxTextBytes": 8388608,
      "timeoutMs": 25000
    },
    "durationMs": 0,
    "errors": [
      {
        "code": "ocr-not-run",
        "message": "1 page has images and no text layer, and no OCR program is configured for this source",
        "page": null
      }
    ],
    "status": "partial"
  },
  "provenance": {
    "adapter": {
      "digest": "sha256:0000000000000000000000000000000000000000000000000000000000000000",
      "name": "adapter-document",
      "version": "fixture"
    },
    "observedAt": "2026-09-16T14:05:11Z",
    "ocr": null,
    "processor": "adapter-document/pdf/1",
    "source": {
      "kind": "inline"
    }
  }
}
