{
  "attachmentVersion": "1",
  "content": {
    "chars": 0,
    "extraction": "none",
    "kind": "text",
    "pageCount": 0,
    "pages": [],
    "truncated": false
  },
  "document": {
    "detectedMediaType": "application/pdf",
    "encryption": {
      "handler": "Standard",
      "opened": false,
      "revision": 3
    },
    "id": "sha256:89504eef6d7131ae2e86abe151c50a1cac989be1965dda7405dd867531dfe15f",
    "mediaType": "application/pdf",
    "name": "encrypted-user.pdf",
    "size": 1006,
    "version": null
  },
  "original": {
    "bytes": null,
    "encoding": null,
    "retention": "caller"
  },
  "processing": {
    "bounds": {
      "maxBytes": 16777216,
      "maxInflateBytes": 67108864,
      "maxOcrOutputBytes": 33554432,
      "maxPages": 500,
      "maxTextBytes": 8388608,
      "timeoutMs": 25000
    },
    "durationMs": 0,
    "errors": [
      {
        "code": "pdf-encrypted",
        "message": "the document is encrypted and a user password is required",
        "page": null
      }
    ],
    "status": "failed"
  },
  "provenance": {
    "adapter": {
      "digest": "sha256:0000000000000000000000000000000000000000000000000000000000000000",
      "name": "adapter-document",
      "version": "fixture"
    },
    "observedAt": "2026-09-16T14:05:11Z",
    "ocr": null,
    "processor": "adapter-document/pdf/1",
    "source": {
      "kind": "inline"
    }
  }
}
