{
  "attachmentVersion": "1",
  "content": {
    "chars": 0,
    "extraction": "none",
    "kind": "text",
    "pageCount": 0,
    "pages": [],
    "truncated": false
  },
  "document": {
    "detectedMediaType": null,
    "encryption": null,
    "id": "sha256:2f4bd031a030e916a671a6beb7b3967642f02d3e68584b85e6f1702509e4ee9f",
    "mediaType": "application/pdf",
    "name": "not-a-pdf.pdf",
    "size": 45,
    "version": null
  },
  "original": {
    "bytes": null,
    "encoding": null,
    "retention": "caller"
  },
  "processing": {
    "bounds": {
      "maxBytes": 16777216,
      "maxInflateBytes": 67108864,
      "maxOcrOutputBytes": 33554432,
      "maxPages": 500,
      "maxTextBytes": 8388608,
      "timeoutMs": 25000
    },
    "durationMs": 0,
    "errors": [
      {
        "code": "media-type-mismatch",
        "message": "declared application/pdf, and the first 1024 bytes hold no %PDF- header",
        "page": null
      }
    ],
    "status": "failed"
  },
  "provenance": {
    "adapter": {
      "digest": "sha256:0000000000000000000000000000000000000000000000000000000000000000",
      "name": "adapter-document",
      "version": "fixture"
    },
    "observedAt": "2026-09-16T14:05:11Z",
    "ocr": null,
    "processor": null,
    "source": {
      "kind": "inline"
    }
  }
}
